
         /\      Grafana   /‾‾/  
    /\  /  \     |\  __   /  /   
   /  \/    \    | |/ /  /   ‾‾\ 
  /          \   |   (  |  (‾)  |
 / __________ \  |_|\_\  \_____/ 

     execution: local
        script: Test/k6/multiUser.js
        output: -

     scenarios: (100.00%) 1 scenario, 18 max VUs, 5m30s max duration (incl. graceful stop):
              * default: 18 looping VUs for 5m0s (gracefulStop: 30s)


running (0m01.0s), 18/18 VUs, 0 complete and 0 interrupted iterations
default   [   0% ] 18 VUs  0m01.0s/5m0s

running (0m02.0s), 18/18 VUs, 0 complete and 0 interrupted iterations
default   [   1% ] 18 VUs  0m02.0s/5m0s

running (0m03.0s), 18/18 VUs, 0 complete and 0 interrupted iterations
default   [   1% ] 18 VUs  0m03.0s/5m0s

running (0m04.0s), 18/18 VUs, 0 complete and 0 interrupted iterations
default   [   1% ] 18 VUs  0m04.0s/5m0s

running (0m05.0s), 18/18 VUs, 0 complete and 0 interrupted iterations
default   [   2% ] 18 VUs  0m05.0s/5m0s

running (0m06.0s), 18/18 VUs, 18 complete and 0 interrupted iterations
default   [   2% ] 18 VUs  0m06.0s/5m0s

running (0m07.0s), 18/18 VUs, 18 complete and 0 interrupted iterations
default   [   2% ] 18 VUs  0m07.0s/5m0s

running (0m08.0s), 18/18 VUs, 18 complete and 0 interrupted iterations
default   [   3% ] 18 VUs  0m08.0s/5m0s

running (0m09.0s), 18/18 VUs, 18 complete and 0 interrupted iterations
default   [   3% ] 18 VUs  0m09.0s/5m0s

running (0m10.0s), 18/18 VUs, 18 complete and 0 interrupted iterations
default   [   3% ] 18 VUs  0m10.0s/5m0s

running (0m11.0s), 18/18 VUs, 36 complete and 0 interrupted iterations
default   [   4% ] 18 VUs  0m11.0s/5m0s

running (0m12.0s), 18/18 VUs, 36 complete and 0 interrupted iterations
default   [   4% ] 18 VUs  0m12.0s/5m0s

running (0m13.0s), 18/18 VUs, 36 complete and 0 interrupted iterations
default   [   4% ] 18 VUs  0m13.0s/5m0s

running (0m14.0s), 18/18 VUs, 36 complete and 0 interrupted iterations
default   [   5% ] 18 VUs  0m14.0s/5m0s

running (0m15.0s), 18/18 VUs, 36 complete and 0 interrupted iterations
default   [   5% ] 18 VUs  0m15.0s/5m0s

running (0m16.0s), 18/18 VUs, 54 complete and 0 interrupted iterations
default   [   5% ] 18 VUs  0m16.0s/5m0s

running (0m17.0s), 18/18 VUs, 54 complete and 0 interrupted iterations
default   [   6% ] 18 VUs  0m17.0s/5m0s

running (0m18.0s), 18/18 VUs, 54 complete and 0 interrupted iterations
default   [   6% ] 18 VUs  0m18.0s/5m0s

running (0m19.0s), 18/18 VUs, 54 complete and 0 interrupted iterations
default   [   6% ] 18 VUs  0m19.0s/5m0s

running (0m20.0s), 18/18 VUs, 54 complete and 0 interrupted iterations
default   [   7% ] 18 VUs  0m20.0s/5m0s

running (0m21.0s), 18/18 VUs, 71 complete and 0 interrupted iterations
default   [   7% ] 18 VUs  0m21.0s/5m0s

running (0m22.0s), 18/18 VUs, 72 complete and 0 interrupted iterations
default   [   7% ] 18 VUs  0m22.0s/5m0s

running (0m23.0s), 18/18 VUs, 72 complete and 0 interrupted iterations
default   [   8% ] 18 VUs  0m23.0s/5m0s

running (0m24.0s), 18/18 VUs, 72 complete and 0 interrupted iterations
default   [   8% ] 18 VUs  0m24.0s/5m0s

running (0m25.0s), 18/18 VUs, 72 complete and 0 interrupted iterations
default   [   8% ] 18 VUs  0m25.0s/5m0s

running (0m26.0s), 18/18 VUs, 84 complete and 0 interrupted iterations
default   [   9% ] 18 VUs  0m26.0s/5m0s

running (0m27.0s), 18/18 VUs, 90 complete and 0 interrupted iterations
default   [   9% ] 18 VUs  0m27.0s/5m0s

running (0m28.0s), 18/18 VUs, 90 complete and 0 interrupted iterations
default   [   9% ] 18 VUs  0m28.0s/5m0s

running (0m29.0s), 18/18 VUs, 90 complete and 0 interrupted iterations
default   [  10% ] 18 VUs  0m29.0s/5m0s

running (0m30.0s), 18/18 VUs, 90 complete and 0 interrupted iterations
default   [  10% ] 18 VUs  0m30.0s/5m0s

running (0m31.0s), 18/18 VUs, 94 complete and 0 interrupted iterations
default   [  10% ] 18 VUs  0m31.0s/5m0s

running (0m32.0s), 18/18 VUs, 108 complete and 0 interrupted iterations
default   [  11% ] 18 VUs  0m32.0s/5m0s

running (0m33.0s), 18/18 VUs, 108 complete and 0 interrupted iterations
default   [  11% ] 18 VUs  0m33.0s/5m0s

running (0m34.0s), 18/18 VUs, 108 complete and 0 interrupted iterations
default   [  11% ] 18 VUs  0m34.0s/5m0s

running (0m35.0s), 18/18 VUs, 108 complete and 0 interrupted iterations
default   [  12% ] 18 VUs  0m35.0s/5m0s

running (0m36.0s), 18/18 VUs, 108 complete and 0 interrupted iterations
default   [  12% ] 18 VUs  0m36.0s/5m0s

running (0m37.0s), 18/18 VUs, 126 complete and 0 interrupted iterations
default   [  12% ] 18 VUs  0m37.0s/5m0s

running (0m38.0s), 18/18 VUs, 126 complete and 0 interrupted iterations
default   [  13% ] 18 VUs  0m38.0s/5m0s

running (0m39.0s), 18/18 VUs, 126 complete and 0 interrupted iterations
default   [  13% ] 18 VUs  0m39.0s/5m0s

running (0m40.0s), 18/18 VUs, 126 complete and 0 interrupted iterations
default   [  13% ] 18 VUs  0m40.0s/5m0s

running (0m41.0s), 18/18 VUs, 126 complete and 0 interrupted iterations
default   [  14% ] 18 VUs  0m41.0s/5m0s

running (0m42.0s), 18/18 VUs, 144 complete and 0 interrupted iterations
default   [  14% ] 18 VUs  0m42.0s/5m0s

running (0m43.0s), 18/18 VUs, 144 complete and 0 interrupted iterations
default   [  14% ] 18 VUs  0m43.0s/5m0s

running (0m44.0s), 18/18 VUs, 144 complete and 0 interrupted iterations
default   [  15% ] 18 VUs  0m44.0s/5m0s

running (0m45.0s), 18/18 VUs, 144 complete and 0 interrupted iterations
default   [  15% ] 18 VUs  0m45.0s/5m0s

running (0m46.0s), 18/18 VUs, 144 complete and 0 interrupted iterations
default   [  15% ] 18 VUs  0m46.0s/5m0s

running (0m47.0s), 18/18 VUs, 162 complete and 0 interrupted iterations
default   [  16% ] 18 VUs  0m47.0s/5m0s

running (0m48.0s), 18/18 VUs, 162 complete and 0 interrupted iterations
default   [  16% ] 18 VUs  0m48.0s/5m0s

running (0m49.0s), 18/18 VUs, 162 complete and 0 interrupted iterations
default   [  16% ] 18 VUs  0m49.0s/5m0s

running (0m50.0s), 18/18 VUs, 162 complete and 0 interrupted iterations
default   [  17% ] 18 VUs  0m50.0s/5m0s

running (0m51.0s), 18/18 VUs, 162 complete and 0 interrupted iterations
default   [  17% ] 18 VUs  0m51.0s/5m0s

running (0m52.0s), 18/18 VUs, 180 complete and 0 interrupted iterations
default   [  17% ] 18 VUs  0m52.0s/5m0s

running (0m53.0s), 18/18 VUs, 180 complete and 0 interrupted iterations
default   [  18% ] 18 VUs  0m53.0s/5m0s

running (0m54.0s), 18/18 VUs, 180 complete and 0 interrupted iterations
default   [  18% ] 18 VUs  0m54.0s/5m0s

running (0m55.0s), 18/18 VUs, 180 complete and 0 interrupted iterations
default   [  18% ] 18 VUs  0m55.0s/5m0s

running (0m56.0s), 18/18 VUs, 180 complete and 0 interrupted iterations
default   [  19% ] 18 VUs  0m56.0s/5m0s

running (0m57.0s), 18/18 VUs, 193 complete and 0 interrupted iterations
default   [  19% ] 18 VUs  0m57.0s/5m0s

running (0m58.0s), 18/18 VUs, 198 complete and 0 interrupted iterations
default   [  19% ] 18 VUs  0m58.0s/5m0s

running (0m59.0s), 18/18 VUs, 198 complete and 0 interrupted iterations
default   [  20% ] 18 VUs  0m59.0s/5m0s

running (1m00.0s), 18/18 VUs, 198 complete and 0 interrupted iterations
default   [  20% ] 18 VUs  1m00.0s/5m0s

running (1m01.0s), 18/18 VUs, 198 complete and 0 interrupted iterations
default   [  20% ] 18 VUs  1m01.0s/5m0s

running (1m02.0s), 18/18 VUs, 206 complete and 0 interrupted iterations
default   [  21% ] 18 VUs  1m02.0s/5m0s

running (1m03.0s), 18/18 VUs, 216 complete and 0 interrupted iterations
default   [  21% ] 18 VUs  1m03.0s/5m0s

running (1m04.0s), 18/18 VUs, 216 complete and 0 interrupted iterations
default   [  21% ] 18 VUs  1m04.0s/5m0s

running (1m05.0s), 18/18 VUs, 216 complete and 0 interrupted iterations
default   [  22% ] 18 VUs  1m05.0s/5m0s

running (1m06.0s), 18/18 VUs, 216 complete and 0 interrupted iterations
default   [  22% ] 18 VUs  1m06.0s/5m0s

running (1m07.0s), 18/18 VUs, 216 complete and 0 interrupted iterations
default   [  22% ] 18 VUs  1m07.0s/5m0s

running (1m08.0s), 18/18 VUs, 234 complete and 0 interrupted iterations
default   [  23% ] 18 VUs  1m08.0s/5m0s

running (1m09.0s), 18/18 VUs, 234 complete and 0 interrupted iterations
default   [  23% ] 18 VUs  1m09.0s/5m0s

running (1m10.0s), 18/18 VUs, 234 complete and 0 interrupted iterations
default   [  23% ] 18 VUs  1m10.0s/5m0s

running (1m11.0s), 18/18 VUs, 234 complete and 0 interrupted iterations
default   [  24% ] 18 VUs  1m11.0s/5m0s

running (1m12.0s), 18/18 VUs, 234 complete and 0 interrupted iterations
default   [  24% ] 18 VUs  1m12.0s/5m0s

running (1m13.0s), 18/18 VUs, 252 complete and 0 interrupted iterations
default   [  24% ] 18 VUs  1m13.0s/5m0s

running (1m14.0s), 18/18 VUs, 252 complete and 0 interrupted iterations
default   [  25% ] 18 VUs  1m14.0s/5m0s

running (1m15.0s), 18/18 VUs, 252 complete and 0 interrupted iterations
default   [  25% ] 18 VUs  1m15.0s/5m0s

running (1m16.0s), 18/18 VUs, 252 complete and 0 interrupted iterations
default   [  25% ] 18 VUs  1m16.0s/5m0s

running (1m17.0s), 18/18 VUs, 252 complete and 0 interrupted iterations
default   [  26% ] 18 VUs  1m17.0s/5m0s

running (1m18.0s), 18/18 VUs, 270 complete and 0 interrupted iterations
default   [  26% ] 18 VUs  1m18.0s/5m0s

running (1m19.0s), 18/18 VUs, 270 complete and 0 interrupted iterations
default   [  26% ] 18 VUs  1m19.0s/5m0s

running (1m20.0s), 18/18 VUs, 270 complete and 0 interrupted iterations
default   [  27% ] 18 VUs  1m20.0s/5m0s

running (1m21.0s), 18/18 VUs, 270 complete and 0 interrupted iterations
default   [  27% ] 18 VUs  1m21.0s/5m0s

running (1m22.0s), 18/18 VUs, 270 complete and 0 interrupted iterations
default   [  27% ] 18 VUs  1m22.0s/5m0s

running (1m23.0s), 18/18 VUs, 288 complete and 0 interrupted iterations
default   [  28% ] 18 VUs  1m23.0s/5m0s

running (1m24.0s), 18/18 VUs, 288 complete and 0 interrupted iterations
default   [  28% ] 18 VUs  1m24.0s/5m0s

running (1m25.0s), 18/18 VUs, 288 complete and 0 interrupted iterations
default   [  28% ] 18 VUs  1m25.0s/5m0s

running (1m26.0s), 18/18 VUs, 288 complete and 0 interrupted iterations
default   [  29% ] 18 VUs  1m26.0s/5m0s

running (1m27.0s), 18/18 VUs, 288 complete and 0 interrupted iterations
default   [  29% ] 18 VUs  1m27.0s/5m0s

running (1m28.0s), 18/18 VUs, 302 complete and 0 interrupted iterations
default   [  29% ] 18 VUs  1m28.0s/5m0s

running (1m29.0s), 18/18 VUs, 306 complete and 0 interrupted iterations
default   [  30% ] 18 VUs  1m29.0s/5m0s

running (1m30.0s), 18/18 VUs, 306 complete and 0 interrupted iterations
default   [  30% ] 18 VUs  1m30.0s/5m0s

running (1m31.0s), 18/18 VUs, 306 complete and 0 interrupted iterations
default   [  30% ] 18 VUs  1m31.0s/5m0s

running (1m32.0s), 18/18 VUs, 306 complete and 0 interrupted iterations
default   [  31% ] 18 VUs  1m32.0s/5m0s

running (1m33.0s), 18/18 VUs, 312 complete and 0 interrupted iterations
default   [  31% ] 18 VUs  1m33.0s/5m0s

running (1m34.0s), 18/18 VUs, 324 complete and 0 interrupted iterations
default   [  31% ] 18 VUs  1m34.0s/5m0s

running (1m35.0s), 18/18 VUs, 324 complete and 0 interrupted iterations
default   [  32% ] 18 VUs  1m35.0s/5m0s

running (1m36.0s), 18/18 VUs, 324 complete and 0 interrupted iterations
default   [  32% ] 18 VUs  1m36.0s/5m0s

running (1m37.0s), 18/18 VUs, 324 complete and 0 interrupted iterations
default   [  32% ] 18 VUs  1m37.0s/5m0s

running (1m38.0s), 18/18 VUs, 324 complete and 0 interrupted iterations
default   [  33% ] 18 VUs  1m38.0s/5m0s

running (1m39.0s), 18/18 VUs, 342 complete and 0 interrupted iterations
default   [  33% ] 18 VUs  1m39.0s/5m0s

running (1m40.0s), 18/18 VUs, 342 complete and 0 interrupted iterations
default   [  33% ] 18 VUs  1m40.0s/5m0s

running (1m41.0s), 18/18 VUs, 342 complete and 0 interrupted iterations
default   [  34% ] 18 VUs  1m41.0s/5m0s

running (1m42.0s), 18/18 VUs, 342 complete and 0 interrupted iterations
default   [  34% ] 18 VUs  1m42.0s/5m0s

running (1m43.0s), 18/18 VUs, 342 complete and 0 interrupted iterations
default   [  34% ] 18 VUs  1m43.0s/5m0s

running (1m44.0s), 18/18 VUs, 360 complete and 0 interrupted iterations
default   [  35% ] 18 VUs  1m44.0s/5m0s

running (1m45.0s), 18/18 VUs, 360 complete and 0 interrupted iterations
default   [  35% ] 18 VUs  1m45.0s/5m0s

running (1m46.0s), 18/18 VUs, 360 complete and 0 interrupted iterations
default   [  35% ] 18 VUs  1m46.0s/5m0s

running (1m47.0s), 18/18 VUs, 360 complete and 0 interrupted iterations
default   [  36% ] 18 VUs  1m47.0s/5m0s

running (1m48.0s), 18/18 VUs, 360 complete and 0 interrupted iterations
default   [  36% ] 18 VUs  1m48.0s/5m0s

running (1m49.0s), 18/18 VUs, 378 complete and 0 interrupted iterations
default   [  36% ] 18 VUs  1m49.0s/5m0s

running (1m50.0s), 18/18 VUs, 378 complete and 0 interrupted iterations
default   [  37% ] 18 VUs  1m50.0s/5m0s

running (1m51.0s), 18/18 VUs, 378 complete and 0 interrupted iterations
default   [  37% ] 18 VUs  1m51.0s/5m0s

running (1m52.0s), 18/18 VUs, 378 complete and 0 interrupted iterations
default   [  37% ] 18 VUs  1m52.0s/5m0s

running (1m53.0s), 18/18 VUs, 378 complete and 0 interrupted iterations
default   [  38% ] 18 VUs  1m53.0s/5m0s

running (1m54.0s), 18/18 VUs, 396 complete and 0 interrupted iterations
default   [  38% ] 18 VUs  1m54.0s/5m0s

running (1m55.0s), 18/18 VUs, 396 complete and 0 interrupted iterations
default   [  38% ] 18 VUs  1m55.0s/5m0s

running (1m56.0s), 18/18 VUs, 396 complete and 0 interrupted iterations
default   [  39% ] 18 VUs  1m56.0s/5m0s

running (1m57.0s), 18/18 VUs, 396 complete and 0 interrupted iterations
default   [  39% ] 18 VUs  1m57.0s/5m0s

running (1m58.0s), 18/18 VUs, 396 complete and 0 interrupted iterations
default   [  39% ] 18 VUs  1m58.0s/5m0s

running (1m59.0s), 18/18 VUs, 408 complete and 0 interrupted iterations
default   [  40% ] 18 VUs  1m59.0s/5m0s

running (2m00.0s), 18/18 VUs, 414 complete and 0 interrupted iterations
default   [  40% ] 18 VUs  2m00.0s/5m0s

running (2m01.0s), 18/18 VUs, 414 complete and 0 interrupted iterations
default   [  40% ] 18 VUs  2m01.0s/5m0s

running (2m02.0s), 18/18 VUs, 414 complete and 0 interrupted iterations
default   [  41% ] 18 VUs  2m02.0s/5m0s

running (2m03.0s), 18/18 VUs, 414 complete and 0 interrupted iterations
default   [  41% ] 18 VUs  2m03.0s/5m0s

running (2m04.0s), 18/18 VUs, 422 complete and 0 interrupted iterations
default   [  41% ] 18 VUs  2m04.0s/5m0s

running (2m05.0s), 18/18 VUs, 432 complete and 0 interrupted iterations
default   [  42% ] 18 VUs  2m05.0s/5m0s

running (2m06.0s), 18/18 VUs, 432 complete and 0 interrupted iterations
default   [  42% ] 18 VUs  2m06.0s/5m0s

running (2m07.0s), 18/18 VUs, 432 complete and 0 interrupted iterations
default   [  42% ] 18 VUs  2m07.0s/5m0s

running (2m08.0s), 18/18 VUs, 432 complete and 0 interrupted iterations
default   [  43% ] 18 VUs  2m08.0s/5m0s

running (2m09.0s), 18/18 VUs, 432 complete and 0 interrupted iterations
default   [  43% ] 18 VUs  2m09.0s/5m0s

running (2m10.0s), 18/18 VUs, 450 complete and 0 interrupted iterations
default   [  43% ] 18 VUs  2m10.0s/5m0s

running (2m11.0s), 18/18 VUs, 450 complete and 0 interrupted iterations
default   [  44% ] 18 VUs  2m11.0s/5m0s

running (2m12.0s), 18/18 VUs, 450 complete and 0 interrupted iterations
default   [  44% ] 18 VUs  2m12.0s/5m0s

running (2m13.0s), 18/18 VUs, 450 complete and 0 interrupted iterations
default   [  44% ] 18 VUs  2m13.0s/5m0s

running (2m14.0s), 18/18 VUs, 450 complete and 0 interrupted iterations
default   [  45% ] 18 VUs  2m14.0s/5m0s

running (2m15.0s), 18/18 VUs, 468 complete and 0 interrupted iterations
default   [  45% ] 18 VUs  2m15.0s/5m0s

running (2m16.0s), 18/18 VUs, 468 complete and 0 interrupted iterations
default   [  45% ] 18 VUs  2m16.0s/5m0s

running (2m17.0s), 18/18 VUs, 468 complete and 0 interrupted iterations
default   [  46% ] 18 VUs  2m17.0s/5m0s

running (2m18.0s), 18/18 VUs, 468 complete and 0 interrupted iterations
default   [  46% ] 18 VUs  2m18.0s/5m0s

running (2m19.0s), 18/18 VUs, 468 complete and 0 interrupted iterations
default   [  46% ] 18 VUs  2m19.0s/5m0s

running (2m20.0s), 18/18 VUs, 486 complete and 0 interrupted iterations
default   [  47% ] 18 VUs  2m20.0s/5m0s

running (2m21.0s), 18/18 VUs, 486 complete and 0 interrupted iterations
default   [  47% ] 18 VUs  2m21.0s/5m0s

running (2m22.0s), 18/18 VUs, 486 complete and 0 interrupted iterations
default   [  47% ] 18 VUs  2m22.0s/5m0s

running (2m23.0s), 18/18 VUs, 486 complete and 0 interrupted iterations
default   [  48% ] 18 VUs  2m23.0s/5m0s

running (2m24.0s), 18/18 VUs, 486 complete and 0 interrupted iterations
default   [  48% ] 18 VUs  2m24.0s/5m0s

running (2m25.0s), 18/18 VUs, 504 complete and 0 interrupted iterations
default   [  48% ] 18 VUs  2m25.0s/5m0s

running (2m26.0s), 18/18 VUs, 504 complete and 0 interrupted iterations
default   [  49% ] 18 VUs  2m26.0s/5m0s

running (2m27.0s), 18/18 VUs, 504 complete and 0 interrupted iterations
default   [  49% ] 18 VUs  2m27.0s/5m0s

running (2m28.0s), 18/18 VUs, 504 complete and 0 interrupted iterations
default   [  49% ] 18 VUs  2m28.0s/5m0s

running (2m29.0s), 18/18 VUs, 504 complete and 0 interrupted iterations
default   [  50% ] 18 VUs  2m29.0s/5m0s

running (2m30.0s), 18/18 VUs, 518 complete and 0 interrupted iterations
default   [  50% ] 18 VUs  2m30.0s/5m0s

running (2m31.0s), 18/18 VUs, 522 complete and 0 interrupted iterations
default   [  50% ] 18 VUs  2m31.0s/5m0s

running (2m32.0s), 18/18 VUs, 522 complete and 0 interrupted iterations
default   [  51% ] 18 VUs  2m32.0s/5m0s

running (2m33.0s), 18/18 VUs, 522 complete and 0 interrupted iterations
default   [  51% ] 18 VUs  2m33.0s/5m0s

running (2m34.0s), 18/18 VUs, 522 complete and 0 interrupted iterations
default   [  51% ] 18 VUs  2m34.0s/5m0s

running (2m35.0s), 18/18 VUs, 530 complete and 0 interrupted iterations
default   [  52% ] 18 VUs  2m35.0s/5m0s

running (2m36.0s), 18/18 VUs, 540 complete and 0 interrupted iterations
default   [  52% ] 18 VUs  2m36.0s/5m0s

running (2m37.0s), 18/18 VUs, 540 complete and 0 interrupted iterations
default   [  52% ] 18 VUs  2m37.0s/5m0s

running (2m38.0s), 18/18 VUs, 540 complete and 0 interrupted iterations
default   [  53% ] 18 VUs  2m38.0s/5m0s

running (2m39.0s), 18/18 VUs, 540 complete and 0 interrupted iterations
default   [  53% ] 18 VUs  2m39.0s/5m0s

running (2m40.0s), 18/18 VUs, 540 complete and 0 interrupted iterations
default   [  53% ] 18 VUs  2m40.0s/5m0s

running (2m41.0s), 18/18 VUs, 558 complete and 0 interrupted iterations
default   [  54% ] 18 VUs  2m41.0s/5m0s

running (2m42.0s), 18/18 VUs, 558 complete and 0 interrupted iterations
default   [  54% ] 18 VUs  2m42.0s/5m0s

running (2m43.0s), 18/18 VUs, 558 complete and 0 interrupted iterations
default   [  54% ] 18 VUs  2m43.0s/5m0s

running (2m44.0s), 18/18 VUs, 558 complete and 0 interrupted iterations
default   [  55% ] 18 VUs  2m44.0s/5m0s

running (2m45.0s), 18/18 VUs, 558 complete and 0 interrupted iterations
default   [  55% ] 18 VUs  2m45.0s/5m0s

running (2m46.0s), 18/18 VUs, 576 complete and 0 interrupted iterations
default   [  55% ] 18 VUs  2m46.0s/5m0s

running (2m47.0s), 18/18 VUs, 576 complete and 0 interrupted iterations
default   [  56% ] 18 VUs  2m47.0s/5m0s

running (2m48.0s), 18/18 VUs, 576 complete and 0 interrupted iterations
default   [  56% ] 18 VUs  2m48.0s/5m0s

running (2m49.0s), 18/18 VUs, 576 complete and 0 interrupted iterations
default   [  56% ] 18 VUs  2m49.0s/5m0s

running (2m50.0s), 18/18 VUs, 576 complete and 0 interrupted iterations
default   [  57% ] 18 VUs  2m50.0s/5m0s

running (2m51.0s), 18/18 VUs, 594 complete and 0 interrupted iterations
default   [  57% ] 18 VUs  2m51.0s/5m0s

running (2m52.0s), 18/18 VUs, 594 complete and 0 interrupted iterations
default   [  57% ] 18 VUs  2m52.0s/5m0s

running (2m53.0s), 18/18 VUs, 594 complete and 0 interrupted iterations
default   [  58% ] 18 VUs  2m53.0s/5m0s

running (2m54.0s), 18/18 VUs, 594 complete and 0 interrupted iterations
default   [  58% ] 18 VUs  2m54.0s/5m0s

running (2m55.0s), 18/18 VUs, 594 complete and 0 interrupted iterations
default   [  58% ] 18 VUs  2m55.0s/5m0s

running (2m56.0s), 18/18 VUs, 612 complete and 0 interrupted iterations
default   [  59% ] 18 VUs  2m56.0s/5m0s

running (2m57.0s), 18/18 VUs, 612 complete and 0 interrupted iterations
default   [  59% ] 18 VUs  2m57.0s/5m0s

running (2m58.0s), 18/18 VUs, 612 complete and 0 interrupted iterations
default   [  59% ] 18 VUs  2m58.0s/5m0s

running (2m59.0s), 18/18 VUs, 612 complete and 0 interrupted iterations
default   [  60% ] 18 VUs  2m59.0s/5m0s

running (3m00.0s), 18/18 VUs, 612 complete and 0 interrupted iterations
default   [  60% ] 18 VUs  3m00.0s/5m0s

running (3m01.0s), 18/18 VUs, 630 complete and 0 interrupted iterations
default   [  60% ] 18 VUs  3m01.0s/5m0s

running (3m02.0s), 18/18 VUs, 630 complete and 0 interrupted iterations
default   [  61% ] 18 VUs  3m02.0s/5m0s

running (3m03.0s), 18/18 VUs, 630 complete and 0 interrupted iterations
default   [  61% ] 18 VUs  3m03.0s/5m0s

running (3m04.0s), 18/18 VUs, 630 complete and 0 interrupted iterations
default   [  61% ] 18 VUs  3m04.0s/5m0s

running (3m05.0s), 18/18 VUs, 630 complete and 0 interrupted iterations
default   [  62% ] 18 VUs  3m05.0s/5m0s

running (3m06.0s), 18/18 VUs, 642 complete and 0 interrupted iterations
default   [  62% ] 18 VUs  3m06.0s/5m0s

running (3m07.0s), 18/18 VUs, 648 complete and 0 interrupted iterations
default   [  62% ] 18 VUs  3m07.0s/5m0s

running (3m08.0s), 18/18 VUs, 648 complete and 0 interrupted iterations
default   [  63% ] 18 VUs  3m08.0s/5m0s

running (3m09.0s), 18/18 VUs, 648 complete and 0 interrupted iterations
default   [  63% ] 18 VUs  3m09.0s/5m0s

running (3m10.0s), 18/18 VUs, 648 complete and 0 interrupted iterations
default   [  63% ] 18 VUs  3m10.0s/5m0s

running (3m11.0s), 18/18 VUs, 656 complete and 0 interrupted iterations
default   [  64% ] 18 VUs  3m11.0s/5m0s

running (3m12.0s), 18/18 VUs, 666 complete and 0 interrupted iterations
default   [  64% ] 18 VUs  3m12.0s/5m0s

running (3m13.0s), 18/18 VUs, 666 complete and 0 interrupted iterations
default   [  64% ] 18 VUs  3m13.0s/5m0s

running (3m14.0s), 18/18 VUs, 666 complete and 0 interrupted iterations
default   [  65% ] 18 VUs  3m14.0s/5m0s

running (3m15.0s), 18/18 VUs, 666 complete and 0 interrupted iterations
default   [  65% ] 18 VUs  3m15.0s/5m0s

running (3m16.0s), 18/18 VUs, 666 complete and 0 interrupted iterations
default   [  65% ] 18 VUs  3m16.0s/5m0s

running (3m17.0s), 18/18 VUs, 684 complete and 0 interrupted iterations
default   [  66% ] 18 VUs  3m17.0s/5m0s

running (3m18.0s), 18/18 VUs, 684 complete and 0 interrupted iterations
default   [  66% ] 18 VUs  3m18.0s/5m0s

running (3m19.0s), 18/18 VUs, 684 complete and 0 interrupted iterations
default   [  66% ] 18 VUs  3m19.0s/5m0s

running (3m20.0s), 18/18 VUs, 684 complete and 0 interrupted iterations
default   [  67% ] 18 VUs  3m20.0s/5m0s

running (3m21.0s), 18/18 VUs, 684 complete and 0 interrupted iterations
default   [  67% ] 18 VUs  3m21.0s/5m0s

running (3m22.0s), 18/18 VUs, 702 complete and 0 interrupted iterations
default   [  67% ] 18 VUs  3m22.0s/5m0s

running (3m23.0s), 18/18 VUs, 702 complete and 0 interrupted iterations
default   [  68% ] 18 VUs  3m23.0s/5m0s

running (3m24.0s), 18/18 VUs, 702 complete and 0 interrupted iterations
default   [  68% ] 18 VUs  3m24.0s/5m0s

running (3m25.0s), 18/18 VUs, 702 complete and 0 interrupted iterations
default   [  68% ] 18 VUs  3m25.0s/5m0s

running (3m26.0s), 18/18 VUs, 702 complete and 0 interrupted iterations
default   [  69% ] 18 VUs  3m26.0s/5m0s

running (3m27.0s), 18/18 VUs, 720 complete and 0 interrupted iterations
default   [  69% ] 18 VUs  3m27.0s/5m0s

running (3m28.0s), 18/18 VUs, 720 complete and 0 interrupted iterations
default   [  69% ] 18 VUs  3m28.0s/5m0s

running (3m29.0s), 18/18 VUs, 720 complete and 0 interrupted iterations
default   [  70% ] 18 VUs  3m29.0s/5m0s

running (3m30.0s), 18/18 VUs, 720 complete and 0 interrupted iterations
default   [  70% ] 18 VUs  3m30.0s/5m0s

running (3m31.0s), 18/18 VUs, 720 complete and 0 interrupted iterations
default   [  70% ] 18 VUs  3m31.0s/5m0s

running (3m32.0s), 18/18 VUs, 738 complete and 0 interrupted iterations
default   [  71% ] 18 VUs  3m32.0s/5m0s

running (3m33.0s), 18/18 VUs, 738 complete and 0 interrupted iterations
default   [  71% ] 18 VUs  3m33.0s/5m0s

running (3m34.0s), 18/18 VUs, 738 complete and 0 interrupted iterations
default   [  71% ] 18 VUs  3m34.0s/5m0s

running (3m35.0s), 18/18 VUs, 738 complete and 0 interrupted iterations
default   [  72% ] 18 VUs  3m35.0s/5m0s

running (3m36.0s), 18/18 VUs, 738 complete and 0 interrupted iterations
default   [  72% ] 18 VUs  3m36.0s/5m0s

running (3m37.0s), 18/18 VUs, 756 complete and 0 interrupted iterations
default   [  72% ] 18 VUs  3m37.0s/5m0s

running (3m38.0s), 18/18 VUs, 756 complete and 0 interrupted iterations
default   [  73% ] 18 VUs  3m38.0s/5m0s

running (3m39.0s), 18/18 VUs, 756 complete and 0 interrupted iterations
default   [  73% ] 18 VUs  3m39.0s/5m0s

running (3m40.0s), 18/18 VUs, 756 complete and 0 interrupted iterations
default   [  73% ] 18 VUs  3m40.0s/5m0s

running (3m41.0s), 18/18 VUs, 756 complete and 0 interrupted iterations
default   [  74% ] 18 VUs  3m41.0s/5m0s

running (3m42.0s), 18/18 VUs, 774 complete and 0 interrupted iterations
default   [  74% ] 18 VUs  3m42.0s/5m0s

running (3m43.0s), 18/18 VUs, 774 complete and 0 interrupted iterations
default   [  74% ] 18 VUs  3m43.0s/5m0s

running (3m44.0s), 18/18 VUs, 774 complete and 0 interrupted iterations
default   [  75% ] 18 VUs  3m44.0s/5m0s

running (3m45.0s), 18/18 VUs, 774 complete and 0 interrupted iterations
default   [  75% ] 18 VUs  3m45.0s/5m0s

running (3m46.0s), 18/18 VUs, 774 complete and 0 interrupted iterations
default   [  75% ] 18 VUs  3m46.0s/5m0s

running (3m47.0s), 18/18 VUs, 785 complete and 0 interrupted iterations
default   [  76% ] 18 VUs  3m47.0s/5m0s

running (3m48.0s), 18/18 VUs, 792 complete and 0 interrupted iterations
default   [  76% ] 18 VUs  3m48.0s/5m0s

running (3m49.0s), 18/18 VUs, 792 complete and 0 interrupted iterations
default   [  76% ] 18 VUs  3m49.0s/5m0s

running (3m50.0s), 18/18 VUs, 792 complete and 0 interrupted iterations
default   [  77% ] 18 VUs  3m50.0s/5m0s

running (3m51.0s), 18/18 VUs, 792 complete and 0 interrupted iterations
default   [  77% ] 18 VUs  3m51.0s/5m0s

running (3m52.0s), 18/18 VUs, 799 complete and 0 interrupted iterations
default   [  77% ] 18 VUs  3m52.0s/5m0s

running (3m53.0s), 18/18 VUs, 810 complete and 0 interrupted iterations
default   [  78% ] 18 VUs  3m53.0s/5m0s

running (3m54.0s), 18/18 VUs, 810 complete and 0 interrupted iterations
default   [  78% ] 18 VUs  3m54.0s/5m0s

running (3m55.0s), 18/18 VUs, 810 complete and 0 interrupted iterations
default   [  78% ] 18 VUs  3m55.0s/5m0s

running (3m56.0s), 18/18 VUs, 810 complete and 0 interrupted iterations
default   [  79% ] 18 VUs  3m56.0s/5m0s

running (3m57.0s), 18/18 VUs, 810 complete and 0 interrupted iterations
default   [  79% ] 18 VUs  3m57.0s/5m0s

running (3m58.0s), 18/18 VUs, 828 complete and 0 interrupted iterations
default   [  79% ] 18 VUs  3m58.0s/5m0s

running (3m59.0s), 18/18 VUs, 828 complete and 0 interrupted iterations
default   [  80% ] 18 VUs  3m59.0s/5m0s

running (4m00.0s), 18/18 VUs, 828 complete and 0 interrupted iterations
default   [  80% ] 18 VUs  4m00.0s/5m0s

running (4m01.0s), 18/18 VUs, 828 complete and 0 interrupted iterations
default   [  80% ] 18 VUs  4m01.0s/5m0s

running (4m02.0s), 18/18 VUs, 828 complete and 0 interrupted iterations
default   [  81% ] 18 VUs  4m02.0s/5m0s

running (4m03.0s), 18/18 VUs, 846 complete and 0 interrupted iterations
default   [  81% ] 18 VUs  4m03.0s/5m0s

running (4m04.0s), 18/18 VUs, 846 complete and 0 interrupted iterations
default   [  81% ] 18 VUs  4m04.0s/5m0s

running (4m05.0s), 18/18 VUs, 846 complete and 0 interrupted iterations
default   [  82% ] 18 VUs  4m05.0s/5m0s

running (4m06.0s), 18/18 VUs, 846 complete and 0 interrupted iterations
default   [  82% ] 18 VUs  4m06.0s/5m0s

running (4m07.0s), 18/18 VUs, 846 complete and 0 interrupted iterations
default   [  82% ] 18 VUs  4m07.0s/5m0s

running (4m08.0s), 18/18 VUs, 864 complete and 0 interrupted iterations
default   [  83% ] 18 VUs  4m08.0s/5m0s

running (4m09.0s), 18/18 VUs, 864 complete and 0 interrupted iterations
default   [  83% ] 18 VUs  4m09.0s/5m0s

running (4m10.0s), 18/18 VUs, 864 complete and 0 interrupted iterations
default   [  83% ] 18 VUs  4m10.0s/5m0s

running (4m11.0s), 18/18 VUs, 864 complete and 0 interrupted iterations
default   [  84% ] 18 VUs  4m11.0s/5m0s

running (4m12.0s), 18/18 VUs, 864 complete and 0 interrupted iterations
default   [  84% ] 18 VUs  4m12.0s/5m0s

running (4m13.0s), 18/18 VUs, 882 complete and 0 interrupted iterations
default   [  84% ] 18 VUs  4m13.0s/5m0s

running (4m14.0s), 18/18 VUs, 882 complete and 0 interrupted iterations
default   [  85% ] 18 VUs  4m14.0s/5m0s

running (4m15.0s), 18/18 VUs, 882 complete and 0 interrupted iterations
default   [  85% ] 18 VUs  4m15.0s/5m0s

running (4m16.0s), 18/18 VUs, 882 complete and 0 interrupted iterations
default   [  85% ] 18 VUs  4m16.0s/5m0s

running (4m17.0s), 18/18 VUs, 882 complete and 0 interrupted iterations
default   [  86% ] 18 VUs  4m17.0s/5m0s

running (4m18.0s), 18/18 VUs, 900 complete and 0 interrupted iterations
default   [  86% ] 18 VUs  4m18.0s/5m0s

running (4m19.0s), 18/18 VUs, 900 complete and 0 interrupted iterations
default   [  86% ] 18 VUs  4m19.0s/5m0s

running (4m20.0s), 18/18 VUs, 900 complete and 0 interrupted iterations
default   [  87% ] 18 VUs  4m20.0s/5m0s

running (4m21.0s), 18/18 VUs, 900 complete and 0 interrupted iterations
default   [  87% ] 18 VUs  4m21.0s/5m0s

running (4m22.0s), 18/18 VUs, 900 complete and 0 interrupted iterations
default   [  87% ] 18 VUs  4m22.0s/5m0s

running (4m23.0s), 18/18 VUs, 918 complete and 0 interrupted iterations
default   [  88% ] 18 VUs  4m23.0s/5m0s

running (4m24.0s), 18/18 VUs, 918 complete and 0 interrupted iterations
default   [  88% ] 18 VUs  4m24.0s/5m0s

running (4m25.0s), 18/18 VUs, 918 complete and 0 interrupted iterations
default   [  88% ] 18 VUs  4m25.0s/5m0s

running (4m26.0s), 18/18 VUs, 918 complete and 0 interrupted iterations
default   [  89% ] 18 VUs  4m26.0s/5m0s

running (4m27.0s), 18/18 VUs, 918 complete and 0 interrupted iterations
default   [  89% ] 18 VUs  4m27.0s/5m0s

running (4m28.0s), 18/18 VUs, 931 complete and 0 interrupted iterations
default   [  89% ] 18 VUs  4m28.0s/5m0s

running (4m29.0s), 18/18 VUs, 936 complete and 0 interrupted iterations
default   [  90% ] 18 VUs  4m29.0s/5m0s

running (4m30.0s), 18/18 VUs, 936 complete and 0 interrupted iterations
default   [  90% ] 18 VUs  4m30.0s/5m0s

running (4m31.0s), 18/18 VUs, 936 complete and 0 interrupted iterations
default   [  90% ] 18 VUs  4m31.0s/5m0s

running (4m32.0s), 18/18 VUs, 936 complete and 0 interrupted iterations
default   [  91% ] 18 VUs  4m32.0s/5m0s

running (4m33.0s), 18/18 VUs, 942 complete and 0 interrupted iterations
default   [  91% ] 18 VUs  4m33.0s/5m0s

running (4m34.0s), 18/18 VUs, 954 complete and 0 interrupted iterations
default   [  91% ] 18 VUs  4m34.0s/5m0s

running (4m35.0s), 18/18 VUs, 954 complete and 0 interrupted iterations
default   [  92% ] 18 VUs  4m35.0s/5m0s

running (4m36.0s), 18/18 VUs, 954 complete and 0 interrupted iterations
default   [  92% ] 18 VUs  4m36.0s/5m0s

running (4m37.0s), 18/18 VUs, 954 complete and 0 interrupted iterations
default   [  92% ] 18 VUs  4m37.0s/5m0s

running (4m38.0s), 18/18 VUs, 954 complete and 0 interrupted iterations
default   [  93% ] 18 VUs  4m38.0s/5m0s

running (4m39.0s), 18/18 VUs, 972 complete and 0 interrupted iterations
default   [  93% ] 18 VUs  4m39.0s/5m0s

running (4m40.0s), 18/18 VUs, 972 complete and 0 interrupted iterations
default   [  93% ] 18 VUs  4m40.0s/5m0s

running (4m41.0s), 18/18 VUs, 972 complete and 0 interrupted iterations
default   [  94% ] 18 VUs  4m41.0s/5m0s

running (4m42.0s), 18/18 VUs, 972 complete and 0 interrupted iterations
default   [  94% ] 18 VUs  4m42.0s/5m0s

running (4m43.0s), 18/18 VUs, 972 complete and 0 interrupted iterations
default   [  94% ] 18 VUs  4m43.0s/5m0s

running (4m44.0s), 18/18 VUs, 990 complete and 0 interrupted iterations
default   [  95% ] 18 VUs  4m44.0s/5m0s

running (4m45.0s), 18/18 VUs, 990 complete and 0 interrupted iterations
default   [  95% ] 18 VUs  4m45.0s/5m0s

running (4m46.0s), 18/18 VUs, 990 complete and 0 interrupted iterations
default   [  95% ] 18 VUs  4m46.0s/5m0s

running (4m47.0s), 18/18 VUs, 990 complete and 0 interrupted iterations
default   [  96% ] 18 VUs  4m47.0s/5m0s

running (4m48.0s), 18/18 VUs, 990 complete and 0 interrupted iterations
default   [  96% ] 18 VUs  4m48.0s/5m0s

running (4m49.0s), 18/18 VUs, 1008 complete and 0 interrupted iterations
default   [  96% ] 18 VUs  4m49.0s/5m0s

running (4m50.0s), 18/18 VUs, 1008 complete and 0 interrupted iterations
default   [  97% ] 18 VUs  4m50.0s/5m0s

running (4m51.0s), 18/18 VUs, 1008 complete and 0 interrupted iterations
default   [  97% ] 18 VUs  4m51.0s/5m0s

running (4m52.0s), 18/18 VUs, 1008 complete and 0 interrupted iterations
default   [  97% ] 18 VUs  4m52.0s/5m0s

running (4m53.0s), 18/18 VUs, 1008 complete and 0 interrupted iterations
default   [  98% ] 18 VUs  4m53.0s/5m0s

running (4m54.0s), 18/18 VUs, 1026 complete and 0 interrupted iterations
default   [  98% ] 18 VUs  4m54.0s/5m0s

running (4m55.0s), 18/18 VUs, 1026 complete and 0 interrupted iterations
default   [  98% ] 18 VUs  4m55.0s/5m0s

running (4m56.0s), 18/18 VUs, 1026 complete and 0 interrupted iterations
default   [  99% ] 18 VUs  4m56.0s/5m0s

running (4m57.0s), 18/18 VUs, 1026 complete and 0 interrupted iterations
default   [  99% ] 18 VUs  4m57.0s/5m0s

running (4m58.0s), 18/18 VUs, 1026 complete and 0 interrupted iterations
default   [  99% ] 18 VUs  4m58.0s/5m0s

running (4m59.0s), 18/18 VUs, 1044 complete and 0 interrupted iterations
default   [ 100% ] 18 VUs  4m59.0s/5m0s

running (5m00.0s), 18/18 VUs, 1044 complete and 0 interrupted iterations
default   [ 100% ] 18 VUs  5m00.0s/5m0s

running (5m01.0s), 18/18 VUs, 1044 complete and 0 interrupted iterations
default ↓ [ 100% ] 18 VUs  5m0s

running (5m02.0s), 18/18 VUs, 1044 complete and 0 interrupted iterations
default ↓ [ 100% ] 18 VUs  5m0s

running (5m03.0s), 18/18 VUs, 1044 complete and 0 interrupted iterations
default ↓ [ 100% ] 18 VUs  5m0s

running (5m04.0s), 03/18 VUs, 1059 complete and 0 interrupted iterations
default ↓ [ 100% ] 18 VUs  5m0s


  █ THRESHOLDS 

    http_req_duration
    ✓ 'p(95)<500' p(95)=135.88ms

    http_req_failed
    ✓ 'rate<0.01' rate=0.00%


  █ TOTAL RESULTS 

    checks_total.......................: 8496    27.943339/s
    checks_succeeded...................: 100.00% 8496 out of 8496
    checks_failed......................: 0.00%   0 out of 8496

    ✓ login exitoso
    ✓ token recibido
    ✓ listado usuarios exitoso
    ✓ usuarios es array
    ✓ usuarios de la clínica correcta
    ✓ listado citas exitoso
    ✓ citas es array
    ✓ citas de la clínica correcta

    HTTP
    http_req_duration.......................................................: avg=49.34ms min=10.06ms med=17.03ms max=539.68ms p(90)=123.39ms p(95)=135.88ms
      { expected_response:true }............................................: avg=49.34ms min=10.06ms med=17.03ms max=539.68ms p(90)=123.39ms p(95)=135.88ms
    http_req_failed.........................................................: 0.00%  0 out of 3186
    http_reqs...............................................................: 3186   10.478752/s

    EXECUTION
    iteration_duration......................................................: avg=5.15s   min=5.11s   med=5.14s   max=5.58s    p(90)=5.18s    p(95)=5.19s   
    iterations..............................................................: 1062   3.492917/s
    vus.....................................................................: 3      min=3         max=18
    vus_max.................................................................: 18     min=18        max=18

    NETWORK
    data_received...........................................................: 4.4 MB 14 kB/s
    data_sent...............................................................: 1.2 MB 3.9 kB/s




running (5m04.0s), 00/18 VUs, 1062 complete and 0 interrupted iterations
default ✓ [ 100% ] 18 VUs  5m0s


